年度,科目,No.,図,問題文,選択肢1,選択肢2,選択肢3,選択肢4,正答
令和3年,構造,10,,木造軸組工法による建築物の設計に関する次の記述のうち、最も不適当なものはどれか。,片面に同じ構造用合板を2枚重ねて釘打ちした耐力壁の倍率を、その構造用合板を1枚で用いたときの耐力壁の倍率の2倍とした。,軸組に方づえを設けて水平力に抵抗させることとしたので、柱が先行破壊しないことを確認した。,圧縮力と引張力の両方を負担する筋かいとして、厚さ3cm、幅9cmの木材を使用した。,地上3階建ての建築物において、構造耐力上主要な1階の柱の小径は、13.5cmを下回らないようにした。,1
令和3年,構造,11,,鉄筋コンクリート構造に関する次の記述のうち、最も不適当なものはどれか。,柱部材は、同じ断面の場合、一般に、内法高さが小さいほど、せん断耐力が大きくなり、靱性は低下する。,コンクリートは圧縮力に強く引張力に弱いので、一般に、同じ断面の柱の場合、大きな軸方向圧縮力を受けるもののほうが靱性は高い。,耐力壁の壁筋の間隔を小さくすると、一般に、耐力壁のひび割れの進展を抑制できる。,柱梁接合部のせん断終局耐力は、一般に、柱梁接合部のコンクリートの圧縮強度が大きくなると増大する。,2
令和3年,構造,12,図あり,図に示す鉄筋コンクリート構造の配筋に関する次の記述のうち、最も不適当なものはどれか。ただし、図に記載のない鉄筋は適切に配筋されているものとする。,梁上端筋の配筋において、ガス圧接継手をスパンの中央部に設けた。,最上階の外柱梁接合部(L形接合部)の配筋において、梁上端筋を機械式定着具で定着した。,スラブの配筋において、スラブの下端筋を梁内に直線定着した。,柱と壁の間に設けた完全スリットにおいて、面外変形を抑えるための鉄筋を設けた。,2
令和3年,構造,13,,鉄筋コンクリート構造の許容応力度計算に関する次の記述のうち、最も不適当なものはどれか。,片側スラブ付き梁部材の曲げ剛性の算定において、スラブの効果を無視して計算を行った。,柱の長期許容曲げモーメントの算定において、コンクリートの引張力の負担を無視して計算を行った。,梁の短期許容せん断力の算定において、主筋のせん断力の負担を無視して計算を行った。,柱の短期許容せん断力の算定において、軸圧縮応力度の効果を無視して計算を行った。,1
令和3年,構造,14,,鉄筋コンクリート構造の保有水平耐力計算に関する次の記述のうち、最も不適当なものはどれか。,増分解析に用いる外力分布は、地震層せん断力係数の建築物の高さ方向の分布を表す係数Aiに基づいて設定した。,全体崩壊形を形成する架構では、構造特性係数Dsは崩壊形を形成した時点の応力等に基づいて算定した。,せん断破壊する耐力壁を有する階では、耐力壁のせん断破壊が生じた時点の層せん断力を当該階の保有水平耐力とした。,付着割裂破壊する柱については、急激な耐力低下のおそれがないので、部材種別をFAとして構造特性係数Dsを算定した。,4
令和3年,構造,15,,鉄骨構造に関する次の記述のうち、最も不適当なものはどれか。,横移動が拘束されていないラーメン架構において、柱材の座屈長さは、梁の剛性を高めても節点間距離より小さくすることはできない。,柱及び梁に使用する鋼材の幅厚比の上限値は、建築構造用圧延鋼材SN400Bに比べてSN490Bのほうが大きい。,ラーメン架構の靱性を高めるため、塑性化が想定される部位に降伏比が小さい材料を採用した。,梁の横座屈を防止するための横補剛材を梁の全長にわたって均等間隔に設けることができなかったので、梁の端部に近い部分を主として横補剛する方法を採用した。,2
令和3年,構造,16,,鉄骨構造の接合部に関する次の記述のうち、最も不適当なものはどれか。,高力ボルト摩擦接合において、肌すきが1mmを超えるものについては、母材や添え板と同様の表面処理を施したフィラープレートを挿入し、高力ボルトを締め付けた。,高力ボルト摩擦接合の二面せん断の短期許容せん断応力度を、高力ボルトの基準張力To(単位N/mm?)に対し、0.9Toとした。,基準強度が同じ溶接部について、完全溶込み溶接とすみ肉溶接におけるそれぞれののど断面に対する許容せん断応力度を、同じ値とした。,角形鋼管柱とH形鋼梁の柱梁仕口部において、梁のフランジ、ウェブとも完全溶込み溶接としたので、梁端接合部の最大曲げ耐力にはスカラップによる断面欠損の有無を考慮しないこととした。,4
令和3年,構造,17,,鉄骨構造の設計に関する次の記述のうち、最も不適当なものはどれか。,ベースプレートの四周にアンカーボルトを用いた露出型柱脚としたので、柱脚には曲げモーメントは生じないものとし、軸方向力及びせん断力に対して柱脚を設計した。,H形鋼梁の横座屈を抑制するため、圧縮側のフランジの横変位を拘束できるように横補剛材を取り付けた。,曲げ剛性に余裕のあるラーメン架構の梁において、梁せいを小さくするために、建築構造用圧延鋼材SN400Bの代わりにSN490Bを用いた。,小梁として、冷間成形角形鋼管を使用したので、横座屈が生じないものとして曲げモーメントに対する断面検定を行った。,1
令和3年,構造,18,,鉄骨構造の耐震計算に関する次の記述のうち、最も不適当なものはどれか。,「ルート1-1」で計算する場合、層間変形角、剛性率、偏心率について確認する必要はない。,「ルート1-2」で計算する場合、梁は、保有耐力横補剛を行う必要はない。,「ルート2」で計算する場合、地階を除き水平力を負担する筋かいの水平力分担率に応じて、地震時の応力を割り増して許容応力度計算を行う必要がある。,「ルート3」で計算する場合、構造特性係数Dsの算定において、柱梁接合部パネルの耐力を考慮する必要はない。,2
令和3年,構造,19,,土質及び地盤に関する次の記述のうち、最も不適当なものはどれか。,土の含水比(土粒子の質量に対する土中の水の質量比)は、一般に、砂質土に比べて粘性土のほうが大きい。,飽和土は、土粒子の間隙部分が全て水で満たされている状態にある。,粘性土地盤において、粘土の粒径は、シルトの粒径に比べて大きい。,地盤の許容支持力度は、標準貫入試験によるN値が同じ場合、一般に、砂質土地盤に比べて粘性土地盤のほうが大きい。,3
令和3年,構造,20,,地盤の沈下に関する次の記述のうち、最も不適当なものはどれか。,地震時に地盤が液状化して沈下する原因は、主に砂粒子の間隙水圧の上昇等により、水が砂混じりで地上に噴出するためである。,地盤の変形特性は非線形性状を示すが、通常の設計においては、地盤を等価な弾性体とみなし、即時沈下の計算を行ってもよい。,粘性土を支持層とする場合は、即時沈下だけではなく、圧密沈下も考慮する必要がある。,圧密沈下は、有効応力の増加に伴って、主に土粒子が変形することにより生じる。,4
令和3年,構造,21,,擁壁及び地下外壁の設計に関する次の記述のうち、最も不適当なものはどれか。,擁壁の滑動に対する検討において、フーチング底面と支持地盤との間の摩擦係数を、土質にかかわらず一定とした。,擁壁背面側の地表面に、等分布荷重が加わることとしたので、鉛直応力の増加分に土圧係数を乗じた値を、主働土圧に加えた。,常時作用する荷重として、地下外壁に作用する水圧を、地下水位からの三角形分布として求めた。,地下外壁の断面設計に用いる静止土圧係数を、土質試験により信頼性の高い結果が得られなかったので、土質にかかわらず0.5とした。,1
令和3年,構造,22,,プレストレストコンクリート構造に関する次の記述のうち、最も不適当なものはどれか。,不静定架構の梁にプレストレス力を導入する場合、曲げ変形と同時に軸方向変形を考慮した不静定二次応力を計算しなければならない。,フルプレストレッシングの設計(I種)は、長期設計荷重時に断面に生じるコンクリートの引張応力を長期許容引張応力度以下に制限するものである。,プレキャストプレストレストコンクリート造の梁を、PC鋼材の緊張により柱と圧着接合する場合、目地モルタルの脱落を防止するために、スターラップ状の曲げ拘束筋やワイヤーメッシュ等による補強を行うことが必要である。,プレストレストコンクリート合成梁では、引張応力が生じるプレキャストプレストレストコンクリート部分と、残りの現場打ち鉄筋コンクリート部分とが一体で挙動できるように、両者を結合する鉄筋を設ける必要がある。,2
令和3年,構造,23,,各種建築構造に関する次の記述のうち、最も不適当なものはどれか。,壁式鉄筋コンクリート構造の建築物では、使用するコンクリートの設計基準強度を高くすると、一般に、必要壁量を小さくすることができる。,壁式鉄筋コンクリート構造と壁式プレキャスト鉄筋コンクリート構造は、一つの建築物の同じ階に混用することができる。,鉄骨鉄筋コンクリート造の埋込み型柱脚の曲げ終局耐力は、柱脚の鉄骨断面の曲げ終局耐力と、柱脚の埋め込み部分の支圧力による曲げ終局耐力の累加により求めることができる。,鉄骨鉄筋コンクリート造の柱では、格子形の非充腹形鉄骨を用いた場合に比べて、フルウェブの充腹形鉄骨を用いた場合のほうが、靱性の向上が期待できる。,3
令和3年,構造,24,,耐震構造、免震構造及び制振構造に関する次の記述のうち、最も不適当なものはどれか。,建築物の耐震性は、一般に、強度と靱性によって評価され、靱性が低い場合には、強度を十分に大きくする必要がある。,免震構造に用いられる、積層ゴムアイソレータの2次形状係数S2(全ゴム層厚に対するゴム直径の比)は、主に座屈荷重や水平剛性に関係する。,免震構造用の積層ゴムにおいて、積層ゴムを構成するゴム1層の厚みを大きくすることは、一般に、鉛直支持能力を向上させる効果がある。,制振構造に用いられる鋼材ダンパー等の履歴減衰型の制振部材は、鋼材等の履歴エネルギー吸収能力を利用するものであり、大地震時には層間変形が小さい段階から当該部材を塑性化させることが有効である。,3
令和3年,構造,25,,既存鉄筋コンクリート造建築物の耐震診断・改修に関する次の記述のうち、最も不適当なものはどれか。,垂れ壁や腰壁が付いた柱は、大地震時に垂れ壁や腰壁が付かない柱より先に破壊するおそれがある。,耐震改修において、柱の耐力の向上を図る方法の一つに、「そで壁付き柱の柱とそで壁との間に耐震スリットを設ける方法」がある。,耐震改修において、耐力の向上を図る方法の一つに、「枠付き鉄骨ブレースを増設する方法」がある。,耐震改修において、柱の変形能力の向上を図る方法の一つに、「炭素繊維巻き付け補強」がある。,2
令和3年,構造,26,,建築物の構造計画に関する次の記述のうち、最も不適当なものはどれか。,建築物の平面形状が細長く、耐力壁が短辺方向の両妻面のみに配置され、剛床と仮定できない場合、両妻面の耐力壁の負担せん断力は、剛床と仮定した場合より大きくなる。,地震時水平力を受けて骨組の水平変形が大きくなると、P-Δ効果による付加的な応力及び水平変形が発生する。,大きいスパンの建築物において、柱を鉄筋コンクリート造、梁を鉄骨造とする場合、異種構造の部材間における応力の伝達を考慮して設計する必要がある。,1階にピロティ階を有する鉄筋コンクリート造建築物において、ピロティ階の独立柱の曲げ降伏による層崩壊を想定する場合、当該階については、地震入力エネルギーの集中を考慮した十分な保有水平耐力を確保する必要がある。,1
令和3年,構造,27,,木材及び木質系材料に関する次の記述のうち、最も不適当なものはどれか。,製材の日本農林規格において、目視等級区分構造用製材は、構造用製材のうち、節、丸身等の材の欠点を目視により測定し、等級区分したものである。,針葉樹は、通直な長大材が得やすく、加工が容易であることから、柱・梁等の構造材をはじめ様々な用途に用いられる。,木材の基準強度は、一般に、せん断に対する基準強度(Fs)に比べて曲げに対する基準強度(Fb)のほうが大きい。,木材の曲げ強度は、樹種が同一の場合、一般に、気乾比重が大きいものほど小さい。,4
令和3年,構造,28,,コンクリートに関する次の記述のうち、最も不適当なものはどれか。,コンクリートの硬化初期の期間中に、コンクリートの温度が想定していた温度より著しく低いと、一般に、強度発現が遅延する。,コンクリートの圧縮強度試験において、一般に、コンクリート供試体の形状が相似の場合、供試体寸法が小さいほど、圧縮強度は大きくなる。,コンクリートの圧縮強度試験用供試体を用いた圧縮強度試験において、荷重速度が速いほど大きい強度を示す。,コンクリートのヤング係数は、一般に、応力ひずみ曲線上における圧縮強度時の点と原点を結ぶ直線の勾配で表される。,4
令和3年,構造,29,,鋼材に関する次の記述のうち、最も不適当なものはどれか。,構造用鋼材では、一般に、炭素量が増加すると、鋼材の強度や硬度が増加するが、靱性や溶接性は低下する。,熱間圧延鋼材の強度は、圧延方向(L方向)や圧延方向に直角な方向(C方向)に比べて、板厚方向(Z方向)は小さい傾向がある。,建築構造用圧延鋼材SN490Bは、降伏点又は耐力の下限値を490 N/mm?とすることのほか、降伏比の上限値や引張強さの下限値等が規定されている。,建築構造用TMCP鋼は、一般に、化学成分の調整と熱加工制御法により製造され、板厚が40mmを超え 100mm以下の材であっても、40mm以下の材と同じ基準強度が保証されている。,3
令和3年,構造,30,,非構造部材等の設計用地震力に関する次の記述のうち、最も不適当なものはどれか。,補強コンクリートブロック造の塀の構造設計に用いる地震力は、地表面から突出する構造物となる煙突に準じたものとする。,建築物の屋上から突出する水槽等の耐震設計において、転倒等に対して危害を防止するための有効な措置が講じられている場合は、地震力を一定の範囲で減じることができる。,高層建築物に設置する設備機器の耐震設計において、設計用水平震度は、一般に、中間階に比べて上層階のほうを大きくする。,一端固定状態のエスカレーターにおける固定部分の設計用地震力の算定において、設計用鉛直標準震度は、一般に、全ての階で同じ数値とする。,4
令和3年,施工,1,,一般的な設計図書に基づく施工計画に関する次の記述のうち、最も不適当なものはどれか。,監理者は、工事施工者から提出を受けた「品質計画、施工の具体的な計画並びに一工程の施工の確認内容及びその確認を行う段階を定めた施工計画書」のうち、品質計画に係る部分について、承認した。,監理者は、一工程の施工の着手前に、総合施工計画書に基づいて工事施工者が作成する工種別施工計画書のうち、工事の品質に影響を及ぼさない工種を省略することについて、承認した。,設計図書に選ぶべき専門工事業者の候補が記載されていなかったので、設計図書に示された工事の内容・品質を達成し得ると考えられる専門工事業者を、事前に工事施工者と協議したうえで、監理者の責任において選定した。,近隣の安全に対して行う仮設計画で、契約書や設計図書に特別の定めがないものについては、工事施工者の責任において決定した。,3
令和3年,施工,2,,工事現場の管理等に関する次の記述のうち、最も不適当なものはどれか。,設計図書間に相違がある場合の適用の優先順位として最も高いものは、一般に、質問回答書である。,公共工事において、特別な要因により工期内に主要な工事材料の日本国内における価格に著しい変動が生じ、請負代金額が不適当となったときは、発注者又は受注者は、請負代金額の変更を請求することができる。,"発注者から事務所の建築一式工事(請負代金額が7,000万円以上)を請け負った元請業者が当該工事を施工するために置く監理技術者については、当該工事現場に専任の監理技術者補佐を置いた場合であっても、当該工事現場のほかの工事現場の監理技術者を兼務することはできない。",産業廃棄物の処理を委託する場合、元請業者は、原則として、廃棄物の量にかかわらず、廃棄物の種類ごと、車両ごとのマニフェストにより、廃棄物が適正に運搬されたこと、処分されたこと及び最終処分されたことを確認する。,3
令和3年,施工,3,,材料管理及び品質管理に関する次の記述のうち、最も不適当なものはどれか。,工事現場に仮置きする既製コンクリート杭については、仮置きするための場所が狭かったので、所定の措置を講じたうえで、同径のものを平置きで2段まで積み重ねる計画とした。,コンクリート工事において、計画供用期間の級が「標準」のコンクリートの練混ぜ水として、レディーミクストコンクリート工場で発生するコンクリートの洗浄排水を処理して得られる回収水で、JISに適合することが確認されたものを用いた。,シーリング工事で用いるバックアップ材は、合成樹脂製でシーリング材に変色等の悪影響を及ぼさず、かつ、シーリング材との接着性がよいものを用いた。,木工事に用いる造作材の工事現場搬入時の含水率は、特記がなかったので、15%以下であることを確認した。,3
令和3年,施工,4,,建築工事等の届出等に関する次の記述のうち、最も不適当なものはどれか。,指定確認検査機関による確認を受けた建築物について、特定行政庁が指定した特定工程に係る工事を終えた日から4日以内に到達するように、「中間検査申請書」を建築主事あてに提出した。,騒音規制法による指定地域内において、特定建設作業を伴う建設工事を施工するに当たって、当該特定建設作業の開始の日の7日前までに、「特定建設作業実施届出書」を市町村長あてに届け出た。,特定元方事業者の労働者及び関係請負人の労働者の作業が同一場所において行われる建築工事の着手に当たって、当該作業の開始後、速やかに「特定元方事業者の事業開始報告」を労働基準監督署長あてに行った。,道路に外部足場を設置するに当たって、継続して道路の一部を使用する必要があったので、「道路使用許可申請書」を道路管理者あてに提出した。,4
令和3年,施工,5,,仮設工事に関する次の記述のうち、最も不適当なものはどれか。,建築物の改修工事のための枠組足場を設置する計画において、高さ12mの枠組足場の組立てから解体までの期間が49日であったので、その計画を労働基準監督署長に届け出なかった。,工事用の資材を上階に運搬するために鉄筋コンクリートの床スラブに設ける仮設用の開口については、補強や復旧等を含む計画書を作成し、監理者の承認を受けた。,ベンチマークから引き出した「各階の通り心と高さの基準になる基準墨」について、監理者の検査を受けた。,"移動式クレーンによる荷の吊り上げ作業において、送電電圧6,600Vの絶縁防護のない配電線からの最小離隔距離(安全距離)については、1.0mを確保した。",4
令和3年,施工,6,,土工事及び山留め工事に関する次の記述のうち、最も不適当なものはどれか。,ウェルポイント工法において、ウェルポイントに接続するライザーパイプについては、揚水能力を確保するために、スリット形ストレーナー管を用いた。,軟弱地盤の掘削において、掘削位置の外周に余裕があったので、ヒービングを防止するために、山留め壁の背面側の地盤のすき取りを行った。,ディープウェルからの揚水を同一帯水層に復水するリチャージ工法を採用したので、その必要揚水量については、復水しないディープウェル工法を採用した場合より多く計画した。,山留め工事において、切ばりが切ばり支柱の一部と平面的に重なってしまったので、切ばり支柱の一部を切り欠いて、補強を行ったうえで、切ばりを通りよくまっすぐに設置した。,1
令和3年,施工,7,,杭地業工事に関する次の記述のうち、最も不適当なものはどれか。,セメントミルク工法による既製コンクリート杭工事において、掘削時の支持層への到達確認については、掘削機の積分電流計の値から算出したN値によることとした。,セメントミルク工法による既製コンクリート杭工事において、掘削時に支持層への到達確認の記録が取得できない杭については、施工前にあらかじめ定めた代替の手法による記録を到達確認の記録とした。,アースドリル工法による場所打ちコンクリート杭工事において、安定液は、ベントナイトを主体として、分散剤や変質防止剤等を加え、できる限り低粘性・低比重となるように配合した。,オールケーシング工法による場所打ちコンクリート杭工事において、トレミー管及びケーシングチューブの先端は、コンクリート中に2m以上入っていることを確認した。,1
令和3年,施工,8,図あり,図に示す鉄筋工事に関する寸法について、最も不適当なものは、次のうちどれか。ただし、鉄筋はSD345、コンクリートの設計基準強度は24N/mm?とし、コンクリートの粗骨材の最大寸法は20mmとする。また、設計図書には特記がないものとし、図に記載のない鉄筋は適切に配筋されているものとする。,鉄筋(D19)のあき [図: リブ間 30mm],地上の耐力壁の鉄筋 (D13)の継手長さ [図: 500mm],大梁の下端筋 (D32)の柱内折曲げ定着の投影定着長さ [図: 650mm],鉄筋(D25)のガス圧接継手の位置 [図: 400mmずらし],2
