年度,科目,No.,図,問題文,選択肢1,選択肢2,選択肢3,選択肢4,正答
令和3年,環境・設備,8,,色彩に関する次の記述のうち、最も不適当なものはどれか。,マンセル表色系において、マンセルバリューが5の色の視感反射率は、一般に、約20%である。,減法混色とは、複数の色光を混ぜ合わせて別の色の知覚を生じさせることをいい、もとの色の数が増加するほど明るくなる。,LED等の人工光源から発せられる光は、相関色温度が等しくても、異なる光色に知覚される場合がある。,XYZ表色系における三刺激値X、Y、Zのうち、Yは、反射物体の色の場合には、視感反射率を示す。,2
令和3年,環境・設備,9,,吸音・遮音に関する次の記述のうち、最も不適当なものはどれか。,単層壁の遮音において、同一の材料の場合、壁の厚さが薄いほど、コインシデンス効果による遮音性能の低下は、より高い周波数域で発生する。,壁の吸音率は、「壁へ入射する音のエネルギー」に対する「壁内部に吸収される音のエネルギーと壁の反対側へ透過する音のエネルギーとの和」の割合である。,子どもの飛び跳ねのような重量床衝撃源による床衝撃音については、カーペット等の柔らかい床仕上げ材を用いても、遮断性能の大幅な向上は期待できない。,中空二重壁の共振透過において、同一の材料を用いて壁間の空気層を厚くすると、共振周波数は高くなる。,4
令和3年,環境・設備,10,,音響に関する次の記述のうち、最も不適当なものはどれか。,音の大きさの感覚量は、音圧レベルが一定の場合、低音域で小さく、10kHz付近で最大となる。,防音塀は、音の回折による減衰を利用して、騒音を低減化するものであり、一般に、低音域よりも高音域において有効である。,無限大の面音源から放射された音は、距離減衰することなく伝搬する。,室内の平均吸音率が大きい場合、セイビン (Sabine)の残響式により求めた残響時間は、アイリング (Eyring)の残響式により求めたものに比べると、長くなる。,1
令和3年,環境・設備,11,,空気調和設備に関する次の記述のうち、最も不適当なものはどれか。,空調用水蓄熱槽の利用温度差を確保するために、熱交換器を通過する蓄熱槽からの水量を一定に制御した。,密閉式冷却塔の省エネルギーを図るために、ファン発停制御及びファン回転数制御を行えるようにした。,遠心冷凍機の成績係数を改善するために、中間期においては、夏期よりも低い冷却水入口温度で運転できるようにした。,ガスエンジンから発生する排熱を利用するために、排熱投入型の吸収冷温水機を設置した。,1
令和3年,環境・設備,12,,事務所の空調方式に関する次の記述のうち、最も不適当なものはどれか。,定風量単一ダクト方式は、一般に、変風量単ーダクト方式に比べて搬送動力の消費量が大きい。,個別分散方式は、空調機を室単位やゾーン単位ごとに設置する方式であり、一般に、天井内等に機器の設置が可能なため、機器等の設置に必要なスペースを小さくすることができる。,放射空調方式は、一般に、天井等に設置した放射パネルを冷却又は加熱することにより放射パネルと人との間で放射熱交換を行う方式であり、気流や温度むらによる不快感が少ない。,床吹出し空調方式は、二重床の床下空間を利用し、床面に設けた吹出し口から空調空気を吹き出す方式であり、一般に、暖房運転時における居住域高さでの垂直温度差は大きい。,4
令和3年,環境・設備,13,,機械換気設備に関する次の記述のうち、最も不適当なものはどれか。,"200m?の一般的な事務室(40席)の換気量を、1,200m?/hとした。","100m?の喫茶店の客席(40席)の換気量を、1,200m?/hとした。","500m?の劇場の客席(400席)の換気量を、6,000m?/hとした。","1,000m?の自走式屋内地下駐車場の換気量を、14,000m?/hとした。",3
令和3年,環境・設備,14,,給排水衛生設備に関する次の記述のうち、最も不適当なものはどれか。,排水を再利用した雑用水については、便器洗浄水や修景用水の他に、清掃用水や冷却塔補給水にも使用した。,給水設備において、上水系統と別系統にした雑用水系統の受水槽については、雑用水用ポンプを設置した給排水衛生設備機械室の直下にある鉄筋コンクリート造の床下ピットを利用した。,雨水を便器洗浄水等で再利用した排水が下水道料金の対象となる地域において、雨水使用量を計測する量水計を設置した。,飲食施設を設けない中小規模の事務所ビルの給水設計において、使用水量の比率を、飲料水30%、雑用水70%とした。,1
令和3年,環境・設備,15,,排水設備等に関する次の記述のうち、最も不適当なものはどれか。,飲食店の厨房の排水系統に設けるグリース阻集器は、一般に、油脂分を取ることのみを目的としているので、下流に臭気等を防止するトラップを別に設ける必要がある。,公共下水道へ排水する場合には、原則として、排水温度を45℃未満にしなければならない。,ディスポーザ排水処理システムは、ディスポーザ、専用の排水配管及び排水処理装置により構成されており、一般に、排水中のBOD等を基準値以下にして、下水道に放流するものである。,即時排水型ビルピット設備は、排水の貯留時間を短くすることにより、硫化水素等の悪臭物質の発生を抑制することができる。,1
令和3年,環境・設備,16,,発電設備等に関する次の記述のうち、最も不適当なものはどれか。,非常電源専用受電設備は、商用電源が停電した場合、消防設備へ電力を供給できなくなるので、大規模な特定防火対象物における消防用設備等の非常電源とすることができない。,消防用設備等の非常電源として用いる自家発電設備で、蓄電池を使用しないものは、常用電源が停電してから電圧確立及び投入までの所要時間を40秒以内とする必要がある。,デュアルフューエルシステムの発電機に用いる燃料は、通常時にはガスを用い、災害等によりガスの供給が停止した場合には重油等を用いることができる。,燃料電池設備は、気体燃料を用いるので、消防用設備等の非常電源とすることができない。,4
令和3年,環境・設備,17,,照明率に関する次の記述のうち、最も不適当なものはどれか。,配光が同じ照明器具においては、器具効率が高いほど照明率は高くなる。,器具効率が同じ照明器具においては、配光の広がりが大きいほど照明率は高くなる。,室の形状を示す室指数が同じであれば、室内反射率が高いほど照明率は高くなる。,室内反射率が同じであれば、室の形状を示す室指数が大きいほど照明率は高くなる。,2
令和3年,環境・設備,18,,消防用設備等に関する次の記述のうち、最も不適当なものはどれか。,"消火薬剤の放射により消火するパッケージ型自動消火設備を、スプリンクラー設備の代替設備として延べ面積1,500m?の特別養護老人ホームに設置した。",窒息効果と冷却効果により消火する泡消火設備を、地下駐車場に設置した。,水幕を張ることにより外部等からの延焼を防止するドレンチャー設備を、重要文化財の神社に設置した。,消防用水を、屋内消火栓設備やスプリンクラー設備等の初期消火設備のための専用水源として設置した。,4
令和3年,環境・設備,19,,建築設備に関する次の記述のうち、最も不適当なものはどれか。,非常用エレベーターの機械室の床面積は、機械の配置及び管理に支障がない場合においては、昇降路の水平投影面積の2倍以上としなくてもよい。,空調用の低圧送風機系統において、同一特性の送風機を2台並列運転させた場合の風量は、一般に、単独運転時の2倍にはならない。,ヒートポンプ給湯機は、大気中の熱エネルギーを給湯の加熱に利用するもので、冷媒に二酸化炭素を用いたものがある。,マルチパッケージ型空調機の屋外機は、屋上に集中設置するよりも各階バルコニーに分散設置するほうが、冷媒管が短く、高低差が少なくなるため、一般に、機器の運転効率は低下する。,4
令和3年,環境・設備,20,,環境・設備に関する次の記述のうち、最も不適当なものはどれか。,建築物省エネルギー性能表示制度(BELS)の5段階のマークは、BEIの値が大きいほど星の数が増える。,「建築物のエネルギー消費性能の向上に関する法律」に基づく新築住宅の省エネルギー基準では、原則として、外皮平均熱貫流率(UA値)や冷房期の平均日射熱取得率 (ηAC値)を地域の区分に応じた基準値以下となること等が求められる。,被災時に救護場所や避難場所となる可能性が高い病院やホテル等の施設を有する企業のBCPにおいては、電気、ガス、水道等のライフラインの広域停止に備えた設備をあらかじめ計画することが望ましい。,地域冷暖房システムの導入は、一般に、未利用熱の活用による排熱削減が期待でき、ヒートアイランド現象の緩和にも効果的である。,1
令和3年,法規,1,,次の記述のうち、建築基準法上、誤っているものはどれか。,土地に定着する観覧のための工作物は、屋根を有しないものであっても、「建築物」に該当する。,幼保連携型認定こども園は、「特殊建築物」に該当する。,鉄筋コンクリート造、地上3階建ての共同住宅における2階の床及びこれを支持するはりに鉄筋を配置する工事の工程は、「特定工程」に該当する。,火災により温度が急激に上昇した場合に自動的に閉鎖する防火戸は、「建築設備」に該当する。,4
令和3年,法規,2,,面積、高さ又は階数に関する次の記述のうち、建築基準法上、誤っているものはどれか。,国土交通大臣が高い開放性を有すると認めて指定する構造の建築物については、その端から水平距離1m以内の部分の水平投影面積は、建築面積に算入しない。,建築物の宅配ボックス設置部分の床面積は、当該建築物の各階の床面積の合計の1/100を限度として、当該建築物の建築基準法第52条第1項に規定する容積率の算定の基礎となる延べ面積(建築物の容積率の最低限度に関する規制に係るものを除く。)に算入しない。,建築物の屋上部分で、水平投影面積の合計が当該建築物の建築面積の1/8以下の塔屋において、その一部に休憩室を設けたものは、当該建築物の階数に算入する。,避雷設備の設置の必要性を検討するに当たっての建築物の高さの算定において、階段室、昇降機塔等の建築物の屋上部分で、その水平投影面積の合計が当該建築物の建築面積の1/8以内の場合、その部分の高さは、12mまでは当該建築物の高さに算入しない。,4
令和3年,法規,3,,準防火地域内における次の行為のうち、建築基準法上、確認済証の交付を受ける必要がないものはどれか。ただし、建築等に関する確認済証の交付を受ける必要がない区域の指定はないものとする。,鉄骨造、延べ面積100m?、平家建ての一戸建ての住宅における、床面積8m?の増築,木造、高さ8m、地上2階建ての飲食店で、その用途に供する部分の床面積の合計が300m?のものにおける、屋根の過半の模様替,"第一種住居地域内にある鉄筋コンクリート造、延べ面積2,000m?、地上2階建ての水泳場の、体育館への用途の変更(大規模の修繕又は大規模の模様替を伴わないもの)",鉄筋コンクリート造、延べ面積300m?、地上3階建ての事務所内における、エレベーターの設置,3
令和3年,法規,4,,次の記述のうち、建築基準法上、誤っているものはどれか。,建築主は、確認済証の交付を受けた建築物について、当該建築物の敷地面積が増加する場合の敷地面積及び敷地境界線の変更(当該敷地境界線の変更により変更前の敷地の一部が除かれる場合を除く。)をして、当該建築物を建築しようとするときは、変更後も建築物の計画が建築基準関係規定に適合することが明らかなものは、あらためて確認済証の交付を受ける必要はない。,"延べ面積2,000m?、地上4階建ての病院の避難施設等に関する工事の施工中において当該建築物を使用する場合においては、当該建築主は、仮使用の認定を受けるとともに、あらかじめ、当該工事の施工中における当該建築物の安全上、防火上又は避難上の措置に関する計画を作成して特定行政庁に届け出なければならない。",鉄骨造、平家建ての診療所(患者の収容施設があるもの)で、その用途に供する部分の床面積の合計が200m?のものを新築する場合においては、当該建築主は、検査済証の交付を受ける前であっても、当該建築物を使用することができる。,鉄筋コンクリート造、延べ面積500m?、地上5階建ての共同住宅を寄宿舎とする用途の変更(大規模の修繕又は大規模の模様替を伴わないもの)に係る確認済証の交付を受けた場合においては、当該建築主は、当該用途の変更に係る工事を完了したときは、建築主事に工事完了届を届け出なければならない。,2
令和3年,法規,5,,次の記述のうち、建築基準法上、誤っているものはどれか。,集会場における客用の階段に代わる高さ1.5m、勾配1/15の傾斜路で、その幅が4mのものには、中間に手すりを設けなくてもよい。,有料老人ホームにおける床面積50m?の入所者用娯楽室には、採光のための窓その他の開口部を設け、その採光に有効な部分の面積は、原則として、5m?以上としなければならない。,共同住宅の天井の全部が強化天井であり、かつ、天井の構造が、隣接する住戸からの日常生活に伴い生ずる音を衛生上支障がないように低減するために天井に必要とされる性能に関して政令で定める技術的基準に適合するもので、国土交通大臣が定めた構造方法を用いるものである場合には、当該共同住宅の各戸の界壁(準耐火構造であるもの)は、小屋裏又は天井裏に達しなくてもよい。,最下階の居室の床が木造である場合における外壁の床下部分には、原則として、壁の長さ5m以下ごとに、面積300cm?以上の換気孔を設け、これにねずみの侵入を防ぐための設備をしなければならない。,1
令和3年,法規,6,,次の記述のうち、建築基準法上、誤っているものはどれか。,防火区画検証法は、開口部に設けられる防火設備について、屋内及び建築物の周囲において発生が予測される火災による火熱が加えられた場合に、火災の継続時間以上、加熱面以外の面に火炎を出すことなく耐えることができることを確かめる方法である。,準防火地域内における共同住宅の屋根の構造は、市街地における通常の火災による火の粉により、防火上有害な発炎をしないものであり、かつ、屋内に達する防火上有害な溶融、亀裂その他の損傷を生じないものでなければならない。,耐火構造の柱は、通常の火災による火熱が所定の時間加えられた場合に、構造耐力上支障のある変形、溶融、破壊その他の損傷を生じないものでなければならない。,不燃材料として、建築物の外部の仕上げに用いる建築材料が適合すべき不燃性能及びその技術的基準は、建築材料に、通常の火災による火熱が加えられた場合に、加熱開始後20分間、「燃焼しないものであること」及び「防火上有害な変形、溶融、亀裂その他の損傷を生じないものであること」である。,1
令和3年,法規,7,,主要構造部を耐火構造とした耐火建築物に関する次の記述のうち、建築基準法に適合しないものはどれか。ただし、自動式のスプリンクラー設備等は設けられていないものとし、居室については、内装の制限を受ける「窓その他の開口部を有しない居室」には該当しないものとする。,地階に設ける劇場の客席及びこれから地上に通ずる主たる廊下、階段その他の通路の壁及び天井の室内に面する部分の仕上げを、準不燃材料でした。,各階が階避難安全性能を有するものであることについて、階避難安全検証法により確かめられた地上20階建ての共同住宅において、特別避難階段の階段室及び付室の天井及び壁の室内に面する部分の仕上げを不燃材料でし、かつ、その下地を準不燃材料で造った。,延べ面積600m?、地上3階建ての図書館において、3階部分にある図書室の壁及び天井の室内に面する部分の仕上げを、難燃材料でした。,"延べ面積1,500m?、地上3階建ての物品販売業を営む店舗において、避難階である1階からその直上階のみに通ずる吹抜きについて、壁及び天井の室内に面する部分の仕上げを不燃材料でし、かつ、その下地を不燃材料で造ったので、吹抜きとなっている部分以外の部分との防火区画を行わなかった。",2
令和3年,法規,8,,各階を物品販売業を営む店舗の用途に供する地上4階建ての建築物(各階の床面積が500 m?)の避難階段に関する次の記述のうち、建築基準法に適合しないものはどれか。ただし、避難階は1階とし、屋上広場はないものとする。,屋外に設ける避難階段を、その階段に通ずる出入口以外の開口部から2.5mの距離に設けた。,屋内に設ける避難階段の部分には、排煙設備を設けなかった。,3階における避難階段の幅の合計を3.0mとした。,各階から1階に通ずる二つの直通階段を設け、そのうちの一つを、有効な防腐措置を講じた準耐火構造の屋外階段とした。,4
令和3年,法規,9,,防火・避難に関する次の記述のうち、建築基準法に適合しないものはどれか。,屋内に設ける避難階段に通ずる出入口に、通常の火災による火熱が加えられた場合に、加熱開始後10分間当該加熱面以外の面に火炎を出さない性能を有する防火戸で所定の構造であるものを設けた。,"延べ面積1,500m?、耐火建築物及び準耐火建築物以外の、木造、地上2階建ての美術館について、防火上有効な構造の防火壁に設ける開口部の幅及び高さを、それぞれ2.5mとし、かつ、これに特定防火設備で所定の構造であるものを設けた。","延べ面積1,500m?の体育館に、非常用の照明装置を設けなかった。",主要構造部を準耐火構造とした建築物の地上部分の層間変形角を、1/150以内となるようにした。,1
令和3年,法規,10,,建築設備に関する次の記述のうち、建築基準法上、誤っているものはどれか。,エレベーター(所定の特殊な構造又は使用形態のものを除く。)の機械室における床面から天井又ははりの下端までの垂直距離は、かごの定格速度が毎分150mの場合、2.2m以上としなければならない。,居室を有する建築物の換気設備についてのホルムアルデヒドに関する技術的基準において、機械換気設備の有効換気量(単位m?/h)は、原則として、その「居室の床面積(単位m?)」と「居室の天井の高さ(単位m)」の積に、住宅の居室にあっては0.5を乗じて得た必要有効換気量以上でなければならない。,耐火構造の床若しくは壁又は防火戸その他の所定の防火設備で床面積100m?以内に区画されたホテルの客室には、窓その他の開口部で開放できる部分(天井又は天井から下方80cm以内の距離にある部分に限る。)の面積の合計が、当該客室の床面積の1/50未満であっても、排煙設備を設置しなくてよい。,エレベーター強度検証法による主要な支持部分等の断面に生ずる常時の応力度は、昇降する部分以外の部分の固定荷重、昇降する部分の固定荷重及びかごの積載荷重を合計した数値により計算する。,4
令和3年,法規,11,,保有水平耐力計算によって安全性が確かめられた建築物に関する次の記述のうち、建築基準法上、誤っているものはどれか。ただし、高さが4mを超える建築物とする。,鉄骨造の建築物において、高力ボルト接合を行う場合、高力ボルト孔の径は、原則として、高力ボルトの径より2mmを超えて大きくしてはならない。,鉄筋コンクリート造の建築物において、鉄筋に対するコンクリートのかぶり厚さは、原則として、直接土に接する柱にあっては、4cm以上としなければならない。,鉄筋コンクリート造の建築物において、主筋の継手の重ね長さは、径の同じ主筋の継手を構造部材における引張力の最も小さい部分に設ける場合にあっては、原則として、主筋の径の25倍以上としなければならない。,鉄骨鉄筋コンクリート造の建築物において、構造耐力上主要な部分である柱の主筋は、4本以上としなければならない。,3
令和3年,法規,12,図あり,図のような木造、地上2階建ての住宅(屋根を金属板で葺いたもの)の1階部分について、桁行方向に設けなければならない構造耐力上必要な軸組の最小限の長さとして、建築基準法上、正しいものは、次のうちどれか。ただし、小屋裏等に物置等は設けず、区域の地盤及び地方の風の状況に応じた「地震力」及び「風圧力」に対する軸組の割増はないものとし、国土交通大臣が定める基準に従った構造計算は行わないものとする。なお、1階部分の軸組の構造の判定に用いる1階の床面積については、60m?とする。また、図は略図とする。,"1,710 cm","1,740 cm","1,980 cm","2,250 cm",3
令和3年,法規,13,,構造強度に関する次の記述のうち、建築基準法上、誤っているものはどれか。,高さ1.2mの組積造の塀(補強コンクリートブロック造を除く。)は、原則として、長さ4m以下ごとに、壁面からその部分における壁の厚さの1.5倍以上突出した控壁(木造のものを除く。)を設けなければならない。,"建築物の実況によらないで、柱の垂直荷重による圧縮力を計算する場合、公会堂の客席(固定席)で、柱がささえる床の数が6のときは、床の積載荷重として採用する数値を1,950 N/m?とすることができる。",許容応力度等計算を行う場合、建築物の地上部分については、所定の地震力によって各階に生ずる層間変形角が所定の数値以内であることを確かめなければならない。,限界耐力計算を行う場合、所定の地震力により建築物の地下部分の構造耐力上主要な部分の断面に生ずる応力度が、短期に生ずる力に対する許容応力度を超えないことを計算により確かめなければならない。,2
